{
  "id": "cite.pellicule",
  "moteurs": [
    "chrono"
  ],
  "libelle": "La pellicule",
  "region": "cite-des-histoires",
  "scene": {
    "fichier": "habillages/cite-des-histoires/pellicule.svg",
    "viewBox": "0 0 960 600",
    "calques": [
      {
        "id": "calque-fond",
        "role": "fond",
        "regions": []
      },
      {
        "id": "calque-zones",
        "role": "coloriable",
        "regions": [
          {
            "id": "mur-blanc",
            "libelle": "le mur blanc",
            "centroide": [
              240,
              93
            ],
            "surface": 170880
          },
          {
            "id": "bande",
            "libelle": "la bande",
            "centroide": [
              480,
              335
            ],
            "surface": 251544
          },
          {
            "id": "perforation",
            "libelle": "la perforation",
            "centroide": [
              310.7,
              227.1
            ],
            "surface": 5040
          },
          {
            "id": "image-un",
            "libelle": "la première image",
            "centroide": [
              221,
              346
            ],
            "surface": 38184
          },
          {
            "id": "image-deux",
            "libelle": "la deuxième image",
            "centroide": [
              489,
              345
            ],
            "surface": 44044
          },
          {
            "id": "image-trois",
            "libelle": "la troisième image",
            "centroide": [
              751,
              345
            ],
            "surface": 32724
          },
          {
            "id": "table-de-montage",
            "libelle": "la table de montage",
            "centroide": [
              900,
              542
            ],
            "surface": 103680
          },
          {
            "id": "loupe",
            "libelle": "la loupe",
            "centroide": [
              127,
              570.6
            ],
            "surface": 4814.1
          },
          {
            "id": "bobine",
            "libelle": "la bobine",
            "centroide": [
              812.3,
              517.3
            ],
            "surface": 8479.4
          }
        ]
      },
      {
        "id": "calque-trait",
        "role": "trait",
        "regions": []
      }
    ]
  },
  "palette": {
    "jetons": {},
    "nuancier": [
      "orange",
      "jaune",
      "rose",
      "violet",
      "blanc",
      "brun"
    ]
  },
  "timings": {
    "appuiMs": 70,
    "relachementMs": 140,
    "refusMs": 190,
    "recolorationMs": 900,
    "interEtoilesMs": 190
  },
  "sons": {
    "ambiance": null,
    "effets": {}
  }
}
