{
  "id": "clairiere.ecole",
  "moteurs": [
    "colorie"
  ],
  "libelle": "La cour de l’école",
  "region": "clairiere",
  "scene": {
    "fichier": "habillages/clairiere/ecole-v2.svg",
    "viewBox": "0 0 922 615",
    "calques": [
      {
        "id": "calque-fond",
        "role": "fond",
        "regions": []
      },
      {
        "id": "calque-zones",
        "role": "coloriable",
        "regions": [
          {
            "id": "ciel",
            "libelle": "le ciel",
            "centroide": [
              461,
              200
            ],
            "surface": 368800
          },
          {
            "id": "herbe",
            "libelle": "l’herbe de la cour",
            "centroide": [
              461,
              507.5
            ],
            "surface": 198230
          },
          {
            "id": "toit-ecole",
            "libelle": "le toit de l’école",
            "centroide": [
              421,
              50
            ],
            "surface": 12264.5
          },
          {
            "id": "horloge-ecole",
            "libelle": "l’horloge de l’école",
            "centroide": [
              215,
              232
            ],
            "surface": 2069.2
          },
          {
            "id": "mur-ecole",
            "libelle": "le mur de l’école",
            "centroide": [
              161.7,
              376.6
            ],
            "surface": 28000
          },
          {
            "id": "porte-ecole",
            "libelle": "la porte de l’école",
            "centroide": [
              429,
              226.5
            ],
            "surface": 12350
          },
          {
            "id": "fenetre-ecole-1",
            "libelle": "la première fenêtre de l’école",
            "centroide": [
              311.5,
              202
            ],
            "surface": 2752
          },
          {
            "id": "fenetre-ecole-2",
            "libelle": "la deuxième fenêtre de l’école",
            "centroide": [
              541,
              201
            ],
            "surface": 3348
          },
          {
            "id": "feuilles-arbre-1",
            "libelle": "les feuilles du premier arbre",
            "centroide": [
              180.4,
              46.94
            ],
            "surface": 33969.5
          },
          {
            "id": "tronc-arbre-1",
            "libelle": "le tronc du premier arbre",
            "centroide": [
              500,
              350
            ],
            "surface": 3400
          },
          {
            "id": "feuilles-arbre-2",
            "libelle": "les feuilles du deuxième arbre",
            "centroide": [
              860.81,
              32.05
            ],
            "surface": 8495.5
          },
          {
            "id": "tronc-arbre-2",
            "libelle": "le tronc du deuxième arbre",
            "centroide": [
              615,
              350
            ],
            "surface": 3400
          },
          {
            "id": "feuilles-arbre-3",
            "libelle": "les feuilles du troisième arbre",
            "centroide": [
              730,
              258
            ],
            "surface": 7155.3
          },
          {
            "id": "tronc-arbre-3",
            "libelle": "le tronc du troisième arbre",
            "centroide": [
              730,
              350
            ],
            "surface": 3400
          },
          {
            "id": "feuilles-arbre-4",
            "libelle": "les feuilles du quatrième arbre",
            "centroide": [
              845,
              258
            ],
            "surface": 7155.3
          },
          {
            "id": "tronc-arbre-4",
            "libelle": "le tronc du quatrième arbre",
            "centroide": [
              845,
              350
            ],
            "surface": 3400
          },
          {
            "id": "cheveux-maitresse",
            "libelle": "les cheveux de la maîtresse",
            "centroide": [
              386.64,
              176.24
            ],
            "surface": 1052.5
          },
          {
            "id": "pull-maitresse",
            "libelle": "le pull de la maîtresse",
            "centroide": [
              386.53,
              232.2
            ],
            "surface": 2869.5
          },
          {
            "id": "jupe-maitresse",
            "libelle": "la jupe de la maîtresse",
            "centroide": [
              175,
              578.3
            ],
            "surface": 4275
          },
          {
            "id": "tableau",
            "libelle": "le tableau de la maîtresse",
            "centroide": [
              188.5,
              236
            ],
            "surface": 19140
          },
          {
            "id": "cheveux-garcon-1",
            "libelle": "les cheveux du premier garçon",
            "centroide": [
              500,
              478
            ],
            "surface": 2088.7
          },
          {
            "id": "tshirt-garcon-1",
            "libelle": "le tee-shirt du premier garçon",
            "centroide": [
              500,
              524.1
            ],
            "surface": 3360
          },
          {
            "id": "cheveux-garcon-2",
            "libelle": "les cheveux du deuxième garçon",
            "centroide": [
              615,
              478
            ],
            "surface": 2088.7
          },
          {
            "id": "tshirt-garcon-2",
            "libelle": "le tee-shirt du deuxième garçon",
            "centroide": [
              615,
              524.1
            ],
            "surface": 3360
          },
          {
            "id": "cheveux-fille-1",
            "libelle": "les cheveux de la première fille",
            "centroide": [
              730,
              478
            ],
            "surface": 2088.7
          },
          {
            "id": "robe-fille-1",
            "libelle": "la robe de la première fille",
            "centroide": [
              730,
              551.8
            ],
            "surface": 6956
          },
          {
            "id": "cheveux-fille-2",
            "libelle": "les cheveux de la deuxième fille",
            "centroide": [
              845,
              478
            ],
            "surface": 2088.7
          },
          {
            "id": "robe-fille-2",
            "libelle": "la robe de la deuxième fille",
            "centroide": [
              845,
              551.8
            ],
            "surface": 6956
          },
          {
            "id": "banc",
            "libelle": "le banc",
            "centroide": [
              147.34,
              371.12
            ],
            "surface": 13429
          },
          {
            "id": "corde",
            "libelle": "la corde à sauter",
            "centroide": [
              120.6,
              574
            ],
            "surface": 3541.2
          },
          {
            "id": "ballon",
            "libelle": "le ballon",
            "centroide": [
              430,
              578
            ],
            "surface": 2264
          }
        ]
      },
      {
        "id": "calque-trait",
        "role": "trait",
        "regions": []
      }
    ]
  },
  "palette": {
    "jetons": {},
    "nuancier": [
      "rouge",
      "orange",
      "jaune",
      "vert",
      "bleu",
      "violet",
      "rose",
      "brun",
      "noir",
      "blanc",
      "gris"
    ]
  },
  "timings": {
    "appuiMs": 60,
    "relachementMs": 120,
    "refusMs": 180,
    "recolorationMs": 900,
    "interEtoilesMs": 180
  },
  "sons": {
    "ambiance": null,
    "effets": {}
  }
}
