{
  "id": "cite.theatre-ombres",
  "moteurs": [
    "histoire"
  ],
  "libelle": "Le théâtre d’ombres",
  "region": "cite-des-histoires",
  "scene": {
    "fichier": "habillages/cite-des-histoires/theatre-ombres.svg",
    "viewBox": "0 0 960 600",
    "calques": [
      {
        "id": "calque-fond",
        "role": "fond",
        "regions": []
      },
      {
        "id": "calque-zones",
        "role": "coloriable",
        "regions": [
          {
            "id": "fond-de-salle",
            "libelle": "le fond de salle",
            "centroide": [
              240,
              58
            ],
            "surface": 103680
          },
          {
            "id": "gradin",
            "libelle": "le gradin",
            "centroide": [
              861.4,
              508.6
            ],
            "surface": 89816
          },
          {
            "id": "estrade",
            "libelle": "l’estrade",
            "centroide": [
              681.3,
              430.1
            ],
            "surface": 51004
          },
          {
            "id": "drap",
            "libelle": "le drap",
            "centroide": [
              480,
              254
            ],
            "surface": 119680
          },
          {
            "id": "silhouette",
            "libelle": "la silhouette",
            "centroide": [
              474,
              240.8
            ],
            "surface": 15314.7
          },
          {
            "id": "rideau",
            "libelle": "le rideau",
            "centroide": [
              105,
              148.3
            ],
            "surface": 182940
          },
          {
            "id": "bougie",
            "libelle": "la bougie",
            "centroide": [
              736,
              312.7
            ],
            "surface": 2546.4
          },
          {
            "id": "lanterne-de-scene",
            "libelle": "la lanterne de scène",
            "centroide": [
              262,
              225.6
            ],
            "surface": 6374
          },
          {
            "id": "coussin-du-gradin",
            "libelle": "le coussin du gradin",
            "centroide": [
              500,
              520
            ],
            "surface": 6220.7
          }
        ]
      },
      {
        "id": "calque-trait",
        "role": "trait",
        "regions": []
      }
    ]
  },
  "palette": {
    "jetons": {},
    "nuancier": [
      "orange",
      "jaune",
      "rose",
      "violet",
      "blanc",
      "brun"
    ]
  },
  "timings": {
    "appuiMs": 80,
    "relachementMs": 150,
    "refusMs": 200,
    "recolorationMs": 950,
    "interEtoilesMs": 200
  },
  "sons": {
    "ambiance": null,
    "effets": {}
  }
}
