{
  "id": "marais.coquillages",
  "moteurs": [
    "paires"
  ],
  "libelle": "Les coquillages jumeaux",
  "region": "marais-jumeau",
  "scene": {
    "fichier": "habillages/marais-jumeau/coquillages.svg",
    "viewBox": "0 0 960 600",
    "calques": [
      {
        "id": "calque-fond",
        "role": "fond",
        "regions": []
      },
      {
        "id": "calque-zones",
        "role": "coloriable",
        "regions": [
          {
            "id": "ciel-de-mer",
            "libelle": "le ciel de mer",
            "centroide": [
              240,
              84
            ],
            "surface": 151680
          },
          {
            "id": "sable-mouille",
            "libelle": "le sable mouillé",
            "centroide": [
              180,
              484.1
            ],
            "surface": 211200
          },
          {
            "id": "ecume",
            "libelle": "l’écume",
            "centroide": [
              480,
              368
            ],
            "surface": 41128.3
          },
          {
            "id": "coquille-un",
            "libelle": "le premier coquillage",
            "centroide": [
              266.2,
              487.7
            ],
            "surface": 17212.4
          },
          {
            "id": "coquille-deux",
            "libelle": "le deuxième coquillage",
            "centroide": [
              489.8,
              494.2
            ],
            "surface": 10159.8
          },
          {
            "id": "algue",
            "libelle": "l’algue",
            "centroide": [
              761,
              430
            ],
            "surface": 12727.5
          },
          {
            "id": "galet",
            "libelle": "le galet",
            "centroide": [
              830.2,
              500
            ],
            "surface": 6163.6
          },
          {
            "id": "etoile-de-mer",
            "libelle": "l’étoile de mer",
            "centroide": [
              620,
              500
            ],
            "surface": 3806.8
          },
          {
            "id": "bois-flotte",
            "libelle": "le bois flotté",
            "centroide": [
              96,
              496.9
            ],
            "surface": 6810.2
          }
        ]
      },
      {
        "id": "calque-trait",
        "role": "trait",
        "regions": []
      }
    ]
  },
  "palette": {
    "jetons": {},
    "nuancier": [
      "bleu",
      "vert",
      "gris",
      "violet",
      "brun",
      "blanc"
    ]
  },
  "timings": {
    "appuiMs": 60,
    "relachementMs": 120,
    "refusMs": 200,
    "recolorationMs": 850,
    "interEtoilesMs": 190
  },
  "sons": {
    "ambiance": null,
    "effets": {}
  }
}
