{
  "id": "galeries.echos",
  "moteurs": [
    "paires"
  ],
  "libelle": "Les cristaux qui se répondent",
  "region": "galeries",
  "scene": {
    "fichier": "habillages/galeries/echos.svg",
    "viewBox": "0 0 960 600",
    "calques": [
      {
        "id": "calque-fond",
        "role": "fond",
        "regions": []
      },
      {
        "id": "calque-zones",
        "role": "coloriable",
        "regions": [
          {
            "id": "paroi-du-fond",
            "libelle": "la paroi du fond",
            "centroide": [
              240,
              79
            ],
            "surface": 142080
          },
          {
            "id": "tapis-de-sable",
            "libelle": "le tapis de sable",
            "centroide": [
              120,
              546.1
            ],
            "surface": 96000
          },
          {
            "id": "niche-des-echos",
            "libelle": "la niche des échos",
            "centroide": [
              147.5,
              330.9
            ],
            "surface": 74305.5
          },
          {
            "id": "cristal-echo-un",
            "libelle": "le premier cristal",
            "centroide": [
              200,
              290.8
            ],
            "surface": 20986
          },
          {
            "id": "cristal-echo-deux",
            "libelle": "le deuxième cristal",
            "centroide": [
              380,
              322.6
            ],
            "surface": 13775.6
          },
          {
            "id": "cristal-echo-trois",
            "libelle": "le troisième cristal",
            "centroide": [
              580,
              313.3
            ],
            "surface": 17673.7
          },
          {
            "id": "cristal-echo-quatre",
            "libelle": "le quatrième cristal",
            "centroide": [
              762,
              335.4
            ],
            "surface": 10869.8
          },
          {
            "id": "goutte-suspendue",
            "libelle": "la goutte suspendue",
            "centroide": [
              480,
              167.3
            ],
            "surface": 2236
          },
          {
            "id": "galet-plat",
            "libelle": "le galet plat",
            "centroide": [
              120,
              540
            ],
            "surface": 3739.6
          }
        ]
      },
      {
        "id": "calque-trait",
        "role": "trait",
        "regions": []
      }
    ]
  },
  "palette": {
    "jetons": {},
    "nuancier": [
      "violet",
      "bleu",
      "gris",
      "blanc",
      "brun",
      "noir"
    ]
  },
  "timings": {
    "appuiMs": 60,
    "relachementMs": 120,
    "refusMs": 180,
    "recolorationMs": 800,
    "interEtoilesMs": 180
  },
  "sons": {
    "ambiance": null,
    "effets": {}
  }
}
