{
  "id": "cite.cartes",
  "moteurs": [
    "paires"
  ],
  "libelle": "Les cartes de la cité",
  "region": "cite-des-histoires",
  "scene": {
    "fichier": "habillages/cite-des-histoires/cartes.svg",
    "viewBox": "0 0 960 600",
    "calques": [
      {
        "id": "calque-fond",
        "role": "fond",
        "regions": []
      },
      {
        "id": "calque-zones",
        "role": "coloriable",
        "regions": [
          {
            "id": "mur-de-la-salle",
            "libelle": "le mur de la salle",
            "centroide": [
              240,
              74
            ],
            "surface": 132480
          },
          {
            "id": "tapis",
            "libelle": "le tapis",
            "centroide": [
              742.4,
              482.3
            ],
            "surface": 111986
          },
          {
            "id": "colonne",
            "libelle": "la colonne",
            "centroide": [
              94,
              284
            ],
            "surface": 23904
          },
          {
            "id": "fresque-murale",
            "libelle": "la fresque murale",
            "centroide": [
              224.4,
              140.1
            ],
            "surface": 47840
          },
          {
            "id": "carte-un",
            "libelle": "la première carte",
            "centroide": [
              319,
              441
            ],
            "surface": 35964
          },
          {
            "id": "carte-deux",
            "libelle": "la deuxième carte",
            "centroide": [
              529,
              451
            ],
            "surface": 28684
          },
          {
            "id": "lanterne",
            "libelle": "la lanterne",
            "centroide": [
              834,
              207.3
            ],
            "surface": 9668.1
          },
          {
            "id": "coussin",
            "libelle": "le coussin",
            "centroide": [
              700,
              480
            ],
            "surface": 9857.5
          },
          {
            "id": "livre-pose",
            "libelle": "le livre posé",
            "centroide": [
              131.9,
              507.7
            ],
            "surface": 8996.8
          }
        ]
      },
      {
        "id": "calque-trait",
        "role": "trait",
        "regions": []
      }
    ]
  },
  "palette": {
    "jetons": {},
    "nuancier": [
      "orange",
      "jaune",
      "rose",
      "violet",
      "blanc",
      "brun"
    ]
  },
  "timings": {
    "appuiMs": 60,
    "relachementMs": 120,
    "refusMs": 200,
    "recolorationMs": 850,
    "interEtoilesMs": 190
  },
  "sons": {
    "ambiance": null,
    "effets": {}
  }
}
