{
  "id": "galeries.cristal",
  "moteurs": [
    "eclair"
  ],
  "libelle": "Le cristal qui s’allume",
  "region": "galeries",
  "scene": {
    "fichier": "habillages/galeries/cristal.svg",
    "viewBox": "0 0 960 600",
    "calques": [
      {
        "id": "calque-fond",
        "role": "fond",
        "regions": []
      },
      {
        "id": "calque-zones",
        "role": "coloriable",
        "regions": [
          {
            "id": "paroi-humide",
            "libelle": "la paroi humide",
            "centroide": [
              240,
              187
            ],
            "surface": 343680
          },
          {
            "id": "sol-de-la-galerie",
            "libelle": "le sol de la galerie",
            "centroide": [
              720,
              565
            ],
            "surface": 59520
          },
          {
            "id": "ombre-longue",
            "libelle": "l’ombre longue",
            "centroide": [
              862.5,
              529.9
            ],
            "surface": 35880
          },
          {
            "id": "socle",
            "libelle": "le socle",
            "centroide": [
              328.5,
              513
            ],
            "surface": 25972
          },
          {
            "id": "cristal-clair",
            "libelle": "le cristal clair",
            "centroide": [
              360,
              265.7
            ],
            "surface": 34790.1
          },
          {
            "id": "cristal-sombre",
            "libelle": "le cristal sombre",
            "centroide": [
              544,
              320.8
            ],
            "surface": 19056.4
          },
          {
            "id": "gouttes",
            "libelle": "les gouttes",
            "centroide": [
              762,
              216.1
            ],
            "surface": 2591.8
          },
          {
            "id": "stalactite-fine",
            "libelle": "la stalactite fine",
            "centroide": [
              160,
              182.3
            ],
            "surface": 1950.1
          },
          {
            "id": "veine-lumineuse",
            "libelle": "la veine lumineuse",
            "centroide": [
              182.4,
              408.6
            ],
            "surface": 5565
          },
          {
            "id": "galet",
            "libelle": "le galet",
            "centroide": [
              831.8,
              540.8
            ],
            "surface": 3510.8
          }
        ]
      },
      {
        "id": "calque-trait",
        "role": "trait",
        "regions": []
      }
    ]
  },
  "palette": {
    "jetons": {},
    "nuancier": [
      "violet",
      "bleu",
      "gris",
      "blanc",
      "brun",
      "noir"
    ]
  },
  "timings": {
    "appuiMs": 40,
    "relachementMs": 90,
    "refusMs": 150,
    "recolorationMs": 600,
    "interEtoilesMs": 150
  },
  "sons": {
    "ambiance": null,
    "effets": {}
  }
}
