{
  "id": "marais.orage",
  "moteurs": [
    "eclair"
  ],
  "libelle": "L’orage sur le marais",
  "region": "marais-jumeau",
  "scene": {
    "fichier": "habillages/marais-jumeau/orage.svg",
    "viewBox": "0 0 960 600",
    "calques": [
      {
        "id": "calque-fond",
        "role": "fond",
        "regions": []
      },
      {
        "id": "calque-zones",
        "role": "coloriable",
        "regions": [
          {
            "id": "ciel-d-orage",
            "libelle": "le ciel d’orage",
            "centroide": [
              360,
              116.9
            ],
            "surface": 209280
          },
          {
            "id": "marais-sombre",
            "libelle": "le marais sombre",
            "centroide": [
              720,
              509
            ],
            "surface": 163200
          },
          {
            "id": "nuage-lourd",
            "libelle": "le nuage lourd",
            "centroide": [
              318.5,
              137
            ],
            "surface": 36271.5
          },
          {
            "id": "eclair-blanc",
            "libelle": "l’éclair blanc",
            "centroide": [
              550.3,
              269.5
            ],
            "surface": 9834.2
          },
          {
            "id": "pluie",
            "libelle": "la pluie",
            "centroide": [
              735.5,
              310.2
            ],
            "surface": 64416
          },
          {
            "id": "saule",
            "libelle": "le saule",
            "centroide": [
              824.1,
              297.6
            ],
            "surface": 24724.7
          },
          {
            "id": "tronc-du-saule",
            "libelle": "le tronc du saule",
            "centroide": [
              830.1,
              515.8
            ],
            "surface": 3798
          },
          {
            "id": "barque",
            "libelle": "la barque",
            "centroide": [
              182.3,
              503.9
            ],
            "surface": 12463.9
          },
          {
            "id": "roseau-courbe",
            "libelle": "le roseau courbé",
            "centroide": [
              612.5,
              549.8
            ],
            "surface": 13521.3
          }
        ]
      },
      {
        "id": "calque-trait",
        "role": "trait",
        "regions": []
      }
    ]
  },
  "palette": {
    "jetons": {},
    "nuancier": [
      "bleu",
      "vert",
      "gris",
      "violet",
      "brun",
      "blanc"
    ]
  },
  "timings": {
    "appuiMs": 40,
    "relachementMs": 90,
    "refusMs": 150,
    "recolorationMs": 600,
    "interEtoilesMs": 150
  },
  "sons": {
    "ambiance": null,
    "effets": {}
  }
}
