{
  "id": "cite.bibliotheque",
  "moteurs": [
    "histoire"
  ],
  "libelle": "La bibliothèque",
  "region": "cite-des-histoires",
  "scene": {
    "fichier": "habillages/cite-des-histoires/bibliotheque.svg",
    "viewBox": "0 0 960 600",
    "calques": [
      {
        "id": "calque-fond",
        "role": "fond",
        "regions": []
      },
      {
        "id": "calque-zones",
        "role": "coloriable",
        "regions": [
          {
            "id": "mur-du-fond",
            "libelle": "le mur du fond",
            "centroide": [
              240,
              63
            ],
            "surface": 113280
          },
          {
            "id": "parquet",
            "libelle": "le parquet",
            "centroide": [
              120,
              542
            ],
            "surface": 105600
          },
          {
            "id": "etagere-haute",
            "libelle": "l’étagère du haut",
            "centroide": [
              97.5,
              169
            ],
            "surface": 39120
          },
          {
            "id": "etagere-basse",
            "libelle": "l’étagère du bas",
            "centroide": [
              97.5,
              337.8
            ],
            "surface": 36520
          },
          {
            "id": "pupitre",
            "libelle": "le pupitre",
            "centroide": [
              799,
              466.2
            ],
            "surface": 10259.6
          },
          {
            "id": "echelle",
            "libelle": "l’échelle",
            "centroide": [
              693.2,
              289
            ],
            "surface": 24437.3
          },
          {
            "id": "vitre",
            "libelle": "la vitre",
            "centroide": [
              778.8,
              135.1
            ],
            "surface": 17640
          },
          {
            "id": "livre-ouvert",
            "libelle": "le livre ouvert",
            "centroide": [
              416.5,
              516.3
            ],
            "surface": 13112.3
          },
          {
            "id": "lampe-de-lecture",
            "libelle": "la lampe de lecture",
            "centroide": [
              97,
              401.7
            ],
            "surface": 5215.4
          }
        ]
      },
      {
        "id": "calque-trait",
        "role": "trait",
        "regions": []
      }
    ]
  },
  "palette": {
    "jetons": {},
    "nuancier": [
      "orange",
      "jaune",
      "rose",
      "violet",
      "blanc",
      "brun"
    ]
  },
  "timings": {
    "appuiMs": 80,
    "relachementMs": 150,
    "refusMs": 200,
    "recolorationMs": 950,
    "interEtoilesMs": 200
  },
  "sons": {
    "ambiance": null,
    "effets": {}
  }
}
