{
  "id": "galeries.pierre",
  "moteurs": [
    "grave"
  ],
  "libelle": "La pierre à graver",
  "region": "galeries",
  "scene": {
    "fichier": "habillages/galeries/pierre.svg",
    "viewBox": "0 0 960 600",
    "calques": [
      {
        "id": "calque-fond",
        "role": "fond",
        "regions": []
      },
      {
        "id": "calque-zones",
        "role": "coloriable",
        "regions": [
          {
            "id": "paroi-seche",
            "libelle": "la paroi sèche",
            "centroide": [
              240,
              94
            ],
            "surface": 170880
          },
          {
            "id": "sol-de-la-salle",
            "libelle": "le sol de la salle",
            "centroide": [
              720,
              556
            ],
            "surface": 76800
          },
          {
            "id": "dalle",
            "libelle": "la dalle",
            "centroide": [
              631.5,
              350.9
            ],
            "surface": 150322
          },
          {
            "id": "sillon",
            "libelle": "le sillon",
            "centroide": [
              272.4,
              318.3
            ],
            "surface": 9760.8
          },
          {
            "id": "burin",
            "libelle": "le burin",
            "centroide": [
              809,
              265
            ],
            "surface": 3406.8
          },
          {
            "id": "eclat",
            "libelle": "l’éclat",
            "centroide": [
              120,
              471
            ],
            "surface": 5073.3
          },
          {
            "id": "torche",
            "libelle": "la torche",
            "centroide": [
              97,
              147.6
            ],
            "surface": 3916.1
          },
          {
            "id": "copeau-de-pierre",
            "libelle": "le copeau de pierre",
            "centroide": [
              881.7,
              511.4
            ],
            "surface": 3612
          },
          {
            "id": "goutte-sur-la-dalle",
            "libelle": "la goutte sur la dalle",
            "centroide": [
              872,
              361.5
            ],
            "surface": 1648.5
          }
        ]
      },
      {
        "id": "calque-trait",
        "role": "trait",
        "regions": []
      }
    ]
  },
  "palette": {
    "jetons": {},
    "nuancier": [
      "violet",
      "bleu",
      "gris",
      "blanc",
      "brun",
      "noir"
    ]
  },
  "timings": {
    "appuiMs": 60,
    "relachementMs": 120,
    "refusMs": 180,
    "recolorationMs": 800,
    "interEtoilesMs": 180
  },
  "sons": {
    "ambiance": null,
    "effets": {}
  }
}
