{
  "id": "volcan.sable",
  "moteurs": [
    "grave"
  ],
  "libelle": "Le sable noir",
  "region": "volcan",
  "scene": {
    "fichier": "habillages/volcan/sable.svg",
    "viewBox": "0 0 960 600",
    "calques": [
      {
        "id": "calque-fond",
        "role": "fond",
        "regions": []
      },
      {
        "id": "calque-zones",
        "role": "coloriable",
        "regions": [
          {
            "id": "ciel-de-cendre",
            "libelle": "le ciel de cendre",
            "centroide": [
              240,
              73.5
            ],
            "surface": 132480
          },
          {
            "id": "mer-sombre",
            "libelle": "la mer sombre",
            "centroide": [
              720,
              285
            ],
            "surface": 96000
          },
          {
            "id": "plage-noire",
            "libelle": "la plage noire",
            "centroide": [
              600,
              466.6
            ],
            "surface": 249600
          },
          {
            "id": "falaise",
            "libelle": "la falaise",
            "centroide": [
              127.8,
              205
            ],
            "surface": 54084
          },
          {
            "id": "trace-doigt",
            "libelle": "la trace du doigt",
            "centroide": [
              702.7,
              414.8
            ],
            "surface": 10276.6
          },
          {
            "id": "galet-chaud",
            "libelle": "le galet chaud",
            "centroide": [
              808.4,
              469
            ],
            "surface": 6181.2
          },
          {
            "id": "vapeur",
            "libelle": "la vapeur",
            "centroide": [
              611,
              213.8
            ],
            "surface": 9251
          },
          {
            "id": "rocher-de-la-plage",
            "libelle": "le rocher de la plage",
            "centroide": [
              153.5,
              474.4
            ],
            "surface": 10801.2
          },
          {
            "id": "coquille-noire",
            "libelle": "la coquille noire",
            "centroide": [
              432.3,
              563
            ],
            "surface": 6281.8
          }
        ]
      },
      {
        "id": "calque-trait",
        "role": "trait",
        "regions": []
      }
    ]
  },
  "palette": {
    "jetons": {},
    "nuancier": [
      "rouge",
      "orange",
      "jaune",
      "noir",
      "gris",
      "brun"
    ]
  },
  "timings": {
    "appuiMs": 60,
    "relachementMs": 120,
    "refusMs": 180,
    "recolorationMs": 800,
    "interEtoilesMs": 180
  },
  "sons": {
    "ambiance": null,
    "effets": {}
  }
}
