{
  "id": "volcan.wagons",
  "moteurs": [
    "tri"
  ],
  "libelle": "Les wagons de la mine",
  "region": "volcan",
  "scene": {
    "fichier": "habillages/volcan/wagons.svg",
    "viewBox": "0 0 960 600",
    "calques": [
      {
        "id": "calque-fond",
        "role": "fond",
        "regions": []
      },
      {
        "id": "calque-zones",
        "role": "coloriable",
        "regions": [
          {
            "id": "wagon-un",
            "libelle": "le premier wagon",
            "centroide": [
              190.0,
              190.0
            ],
            "surface": 32000.0
          },
          {
            "id": "wagon-deux",
            "libelle": "le deuxième wagon",
            "centroide": [
              480.0,
              190.0
            ],
            "surface": 32000.0
          },
          {
            "id": "wagon-trois",
            "libelle": "le troisième wagon",
            "centroide": [
              770.0,
              190.0
            ],
            "surface": 32000.0
          },
          {
            "id": "rail",
            "libelle": "le rail",
            "centroide": [
              190.0,
              420.0
            ],
            "surface": 32000.0
          },
          {
            "id": "braise",
            "libelle": "la braise",
            "centroide": [
              480.0,
              420.0
            ],
            "surface": 32000.0
          },
          {
            "id": "paroi",
            "libelle": "la paroi",
            "centroide": [
              770.0,
              420.0
            ],
            "surface": 32000.0
          }
        ]
      },
      {
        "id": "calque-trait",
        "role": "trait",
        "regions": []
      }
    ]
  },
  "palette": {
    "jetons": {},
    "nuancier": [
      "rouge",
      "orange",
      "jaune",
      "noir",
      "gris",
      "brun"
    ]
  },
  "timings": {
    "appuiMs": 60,
    "relachementMs": 120,
    "refusMs": 180,
    "recolorationMs": 800,
    "interEtoilesMs": 180
  },
  "sons": {
    "ambiance": null,
    "effets": {}
  }
}
