{
  "id": "galeries.paroi-libre",
  "moteurs": [
    "libre"
  ],
  "libelle": "La paroi qu’on peint comme on veut",
  "region": "galeries",
  "scene": {
    "fichier": "habillages/galeries/paroi-libre.svg",
    "viewBox": "0 0 960 600",
    "calques": [
      {
        "id": "calque-fond",
        "role": "fond",
        "regions": []
      },
      {
        "id": "calque-zones",
        "role": "coloriable",
        "regions": [
          {
            "id": "ombre-du-fond",
            "libelle": "l’ombre du fond",
            "centroide": [
              360,
              120.9
            ],
            "surface": 218880
          },
          {
            "id": "sol-de-la-paroi",
            "libelle": "le sol de la paroi",
            "centroide": [
              180,
              565.6
            ],
            "surface": 57600
          },
          {
            "id": "grande-paroi",
            "libelle": "la grande paroi",
            "centroide": [
              291,
              325
            ],
            "surface": 150094
          },
          {
            "id": "petite-paroi",
            "libelle": "la petite paroi",
            "centroide": [
              751,
              345
            ],
            "surface": 69054
          },
          {
            "id": "veine-de-cristal",
            "libelle": "la veine de cristal",
            "centroide": [
              96.9,
              293.8
            ],
            "surface": 7738.4
          },
          {
            "id": "goutte-de-pluie",
            "libelle": "la goutte de pluie",
            "centroide": [
              700,
              226.1
            ],
            "surface": 2415.9
          },
          {
            "id": "pierre-ronde",
            "libelle": "la pierre ronde",
            "centroide": [
              289.6,
              529.5
            ],
            "surface": 9942.9
          },
          {
            "id": "niche-vide",
            "libelle": "la niche vide",
            "centroide": [
              762,
              354
            ],
            "surface": 23995.1
          },
          {
            "id": "cristal-oublie",
            "libelle": "le cristal oublié",
            "centroide": [
              866,
              351.6
            ],
            "surface": 7504
          }
        ]
      },
      {
        "id": "calque-trait",
        "role": "trait",
        "regions": []
      }
    ]
  },
  "palette": {
    "jetons": {},
    "nuancier": [
      "rouge",
      "orange",
      "jaune",
      "vert",
      "bleu",
      "violet",
      "rose",
      "brun",
      "noir",
      "blanc",
      "gris"
    ]
  },
  "timings": {
    "appuiMs": 60,
    "relachementMs": 120,
    "refusMs": 180,
    "recolorationMs": 800,
    "interEtoilesMs": 180
  },
  "sons": {
    "ambiance": null,
    "effets": {}
  }
}
